code,name, providerName
2312011964,ISSIMA SOPA DE  POLLO C/VEGETALES 64GRS,86 - DINANT
2512012550,VENZA JAB VITAMINA E 110GRS,86 - DINANT
2512012552,VENZA JAB FRESCURA EXTREMA 110GRS,86 - DINANT
2512012551,VENZA JAB SABILA 110GRS,86 - DINANT
2512012549,VENZA JAB AVENA 110GRS,86 - DINANT
2312009935,YUMMIES MANI /SAL 80GRS,86 - DINANT
2312009637,YUMMIES MIX SEMILLAS Y FRUTAS 80GRS,86 - DINANT
2312003992,YUMMIES MANI C/LIMON 80GRS,86 - DINANT
2512012555,VENZA JAB SABILA 110GRS 3PACK,86 - DINANT
2512012554,VENZA JAB VITAMINA E 110GRS 3PACK,86 - DINANT
2312012518,ZAMBOS SALSA VERDE 140GRS,86 - DINANT
2512012556,VENZA JAB FRESCURA EXTREMA 110GRS 3PACK,86 - DINANT
2312004016,ZAMBOS CASEROS 155GRS,86 - DINANT
2512012553,VENZA JAB AVENA 110GRS 3PACK,86 - DINANT
2312012514,YUMMIES MANI JAPONES 80GRS,86 - DINANT
2312009939,ZIBAS CREMA Y ESPECIAS 80GRS,86 - DINANT
2312012453,ISSIMA SOPA DE  POLLO C/VEGETALES PICANTE 64GRS,86 - DINANT
2312003980,RANCHITAS NACHO QUESO 150GRS,86 - DINANT
2312012702,ZAMBOS YUQUITAS ORIGINALES 130GRS,86 - DINANT
2312003851,ZIBAS ANILLITO DE PAPA BBQ 150GRS,86 - DINANT
2312004055,ZAMBOS CON CHICHARRON 155GRS,86 - DINANT
2312004015,ZIBAS CLASICA 80GRS,86 - DINANT
2312012703,ZAMBOS YUQUITAS CHILE TOREADO 130GRS,86 - DINANT
2312009846,TAQUERITOS EXTREMOS QUESO FUSION 190GRS,86 - DINANT
2312012519,ZAMBOS CEVICHE 140GRS,86 - DINANT
2312009844,TAQUERITOS  EXTREMOS CHILE TOREADO 190GRS,86 - DINANT
2312004084,ZAMBOS PICANTES 155GRS,86 - DINANT
2312009941,ZIBAS QUESO 80GRS,86 - DINANT
2312011963,ZIBAS MIEL Y MOSTAZA 80GRS,86 - DINANT
2312004136,RANCHITAS NACHO EXITANTE 150GRS,86 - DINANT
2312004130,YUMMIES  MARAÑON CON SAL 25GRS,86 - DINANT
2312012181,NATURAS NECTAR PERA 200ML,86 - DINANT
2312013578,ZIBAS KETCHUP 80GRS,86 - DINANT
2312003973,DEL RANCHO CHICHARRONES AUTENTICOS 110GRS,86 - DINANT
2312012182,NATURAS NECTAR MELOCOTON 200ML,86 - DINANT
2312009933,YUMMIES MANI CHILE 80GRS,86 - DINANT
2312004035,DEL RANCHO CHICHARRONES PICOSITOS 110GRS,86 - DINANT
2312012180,NATURAS NECTAR MANZANA 200ML,86 - DINANT
2312012516,YUMMIES NUTS OMEGA MIX 42.5GRS,86 - DINANT
2312012625,COMBO ANILLITOS/ZIBAS CLASICA /ZAMBOS PICOSITOS,86 - DINANT
2312009936,YUMMIES SEMILLAS MARAÑON 80GRS,86 - DINANT
2312012179,NATURAS NECTAR SIX PACK UND X6,86 - DINANT
2312012624,COMBO RANCHITAS/ZAMBOS CHICHA/ZIBAS CREMA&ESPECIAS,86 - DINANT
2312013084,WONDERFUL PISTACHOS 42GRS,86 - DINANT
2312009784,YUMMIES ROSQUILLAS 23GRS,492 - YUMMIES
2512008108,REXONA COTTON DRY DEO/BAR 50GRS,330 - UNILEVER
2512012905,REXONA POWDER WOMEN DEO/BAR 45GRS,330 - UNILEVER
2512001098,REXONA V8 MEN DEO/BAR 50GRS,330 - UNILEVER
2512006284,REXONA ANTIBACTERIAL MEN DEO/BAR 50GRS,330 - UNILEVER
2512001105,REXONA SPORTFAN MEN DEO/BAR 50GRS,330 - UNILEVER
2512006289,AXE DARK TEMPT SPRAY  96GRS/150ML,330 - UNILEVER
2512012721,REXONA TROPICAL ENERGY DEO/BAR 50GRS,330 - UNILEVER
2512011232,REXONA ANTI/BACTERIAL FRESH MUJER DEO/BAR 50GRS,330 - UNILEVER
2512012635,REXONA STAY FRESH WOMEN DEO/BAR 45GRS,330 - UNILEVER
2512012720,REXONA TONO PERFECTO DEO/BAR 45GRS,330 - UNILEVER
2512013553,AXE EPIC FRESH DEO SPRAY 150ML,330 - UNILEVER
2512006287,AXE  BS GOLD TEMPT 96GRS/150ML,330 - UNILEVER
2512011234,REXONA ANTI/BACTERIAL INVISIBLE HOMBRE DEO/BAR 50GRS,330 - UNILEVER
2512007740,REXONA INVISIBLE WOMEN DEO/BAR 50GRS,330 - UNILEVER
2512011233,REXONA INVISIBLE HOMBRE DEO/BAR 50GRS,330 - UNILEVER
2512011924,REXONA ANTIBACTERIAL FRESH DEO/BAR 50GRS,330 - UNILEVER
2512006286,AXE  BS EXCITE AER 96GRS/150ML,330 - UNILEVER
2512001110,REXONA POWDER WOMEN DEO/BAR 50GRS,330 - UNILEVER
2512001079,DOVE STICK ORIGINAL DEO BAR 50GRS,330 - UNILEVER
2512006326,AXE APOLLO SPRAY BODY 96GRS,330 - UNILEVER
2512001741,DOVE CLEAR TONE DEO BAR 50G,330 - UNILEVER
2512006736,DOVE DERMO ACLARANTE AER 89GRS,330 - UNILEVER
2512008110,DOVE INVISIBLE DRY DEO AER 89GRS,330 - UNILEVER
2512001078,DOVE PEPINO/TE GOFRESH BAR 50GRS,330 - UNILEVER
2512011854,AXE DEO ICE CHILL SPRAY 150 ML,330 - UNILEVER
2512001080,DOVE INVISIBLE DRY BAR 50GRS,330 - UNILEVER
2512004468,DOVE DERMO ACLARANTE BARRA 50GRS,330 - UNILEVER
2512001075,DOVE ORIGINAL AER 150GRS,330 - UNILEVER
2512012069,AXE COLLISION  BODY SPRAY 150ML,330 - UNILEVER
2512008114,DOVE MEN CUIDADO TOTAL DEO BAR 50GRS,330 - UNILEVER
2512012028,REXONA MEN SPORTFAN DEO/AER 150GRS,330 - UNILEVER
2512001091,REXONA V8 MEN DEO/AER 105GRS,330 - UNILEVER
2512012026,REXONA WOMEN BAMBOO & ALOE VERA DEO/AER 150GRS,330 - UNILEVER
2512008113,DOVE MEN EXTRA FRESH DEO BAR 50GRS,330 - UNILEVER
2512007661,DEGREE DEO BAR MUJER SHOWER CLEAN 74GRS,330 - UNILEVER
2512001030,DOVE BLANCO ORIGINAL JAB 90GRS,330 - UNILEVER
2512012636,DOVE PEPINO/TE GOFRESH AER 150ML,330 - UNILEVER
2512012023,REXONA COTTON WOMEN DEO/AER 150ML,330 - UNILEVER
2510021957,EGO POWER GEL X200ML,330 - UNILEVER
2512013007,DOVE CLEAR TONE DEO SPRAY 150ML,330 - UNILEVER
2512001072,DOVE PEPINO/TE GOFRESH AER 89GRS,330 - UNILEVER
2512008112,DOVE MEN INVISIBLE DRY DEO BAR 50GRS,330 - UNILEVER
2512013050,DOVE JABON LECHE DE COCO 90GRS,330 - UNILEVER
2512012117,EGO ALFA GEL 200ML,330 - UNILEVER
2512013060,AXE COLLISION CUERO & COOKIES  SPRAY 152ML,330 - UNILEVER
2512008006,DOVE MEN INVISIBLE DRY DEO AER 89GRS,330 - UNILEVER
2512012118,EGO ATTRACTION GEL 200ML,330 - UNILEVER
2512013008,DOVE MEN CUIDADO TOTAL DEO SPRAY 150ML,330 - UNILEVER
2512013009,DOVE MEN EXTRA FRESH DEO SPRAY 150ML,330 - UNILEVER
2512007660,DEGREE DEO BAR HOM DRY PROTECTION 76GRS,330 - UNILEVER
2512013021,DOVE JAB ANTIBACTERIAL 90GRS,330 - UNILEVER
2512013058,AXE ICE CHILL ANTITRANSPIRANTE SPRAY 152ML,330 - UNILEVER
2512013020,REXONA CLINICAL EXPERT DEO/BAR MUJER 46GRS,330 - UNILEVER
2512001031,DOVE JAB ORIGINAL 135GRS,330 - UNILEVER
2512008357,IRISH SPRING JAB DE BAÑO ORIG 106.3GRS,330 - UNILEVER
2512011782,REXONA DEO CLINICAL EXPERT CLEAN MEN AER 150ML,330 - UNILEVER
2512011783,REXONA DEO CLINICAL EXPERT CLASSIC WOMAN 150ML,330 - UNILEVER
2512013022,DOVE JAB ANTIBACTERIAL 135GRS,330 - UNILEVER
2512013551,DOVE TONO UNIFORME DEO SPRAY 150ML,330 - UNILEVER
2512013554,REXONA ACTIVE DRY DEO SPRAY 150ML,330 - UNILEVER
2112011288,CHIQUITIN PAÑ GDE UND X5,253 - PAINSA
2112011289,CHIQUITIN PAÑ  XG UND X5,253 - PAINSA
2112011290,CHIQUITIN PAÑ XXG UND X5,253 - PAINSA
2112011287,CHIQUITIN PAÑ MED UND X5,253 - PAINSA
2112011286,CHIQUITIN PAÑ PQ UND X5,253 - PAINSA
2112011209,CHIQUITIN TOA HUM XL  UND X90,253 - PAINSA
2612004682,NUBE BLANCA PAPEL HIGIENICO X1000,253 - PAINSA
2612005314,ROSAL XG PAPEL HIG 430HOJAS,253 - PAINSA
